client_id	path	sentence	up_votes	down_votes	age	gender	accents	variant	locale	segment
1a0eea2cb817ad4f14b1465947dd92a6fabdd3a50bb9a62f6675cce6900845b7b709c9be4d77ac2b341c02efa5255cddcb315f13fad7e5feb00ab6a112c4aadd	common_voice_ru_36635861.mp3	Ей хотелось побыть одной с своими мыслями.	0	2					ru	
1a0eea2cb817ad4f14b1465947dd92a6fabdd3a50bb9a62f6675cce6900845b7b709c9be4d77ac2b341c02efa5255cddcb315f13fad7e5feb00ab6a112c4aadd	common_voice_ru_36635928.mp3	И ей легко было вспомнить о Левине.	0	2					ru	
1d616fa1b36f41495749a7364a4a1736a589375a5400d7ed127327df4e552dd5bbe4f71b608a9fa6da682debae8f2f391ae7afe43e3210eabd70a696623bc6fa	common_voice_ru_36639706.mp3	– Я не знаю, какой вы инженер, но… чините вы машину как-то очень странно.	2	2			без акцента		ru	
1d616fa1b36f41495749a7364a4a1736a589375a5400d7ed127327df4e552dd5bbe4f71b608a9fa6da682debae8f2f391ae7afe43e3210eabd70a696623bc6fa	common_voice_ru_36651877.mp3	Те электричеством измерили мой ум и просто опупели.	0	2			без акцента		ru	
1d616fa1b36f41495749a7364a4a1736a589375a5400d7ed127327df4e552dd5bbe4f71b608a9fa6da682debae8f2f391ae7afe43e3210eabd70a696623bc6fa	common_voice_ru_36654720.mp3	Япония продолжает работать над обеспечением и продвижением органичного подхода к миростроительству.	0	4			без акцента		ru	
1d616fa1b36f41495749a7364a4a1736a589375a5400d7ed127327df4e552dd5bbe4f71b608a9fa6da682debae8f2f391ae7afe43e3210eabd70a696623bc6fa	common_voice_ru_36654731.mp3	Марья Ивановна от меня не отходила.	0	2			без акцента		ru	
1d616fa1b36f41495749a7364a4a1736a589375a5400d7ed127327df4e552dd5bbe4f71b608a9fa6da682debae8f2f391ae7afe43e3210eabd70a696623bc6fa	common_voice_ru_36654777.mp3	Все чиновники говорили о ненадежности войск, о неверности удачи, об осторожности и тому подобном.	0	2			без акцента		ru	
1d616fa1b36f41495749a7364a4a1736a589375a5400d7ed127327df4e552dd5bbe4f71b608a9fa6da682debae8f2f391ae7afe43e3210eabd70a696623bc6fa	common_voice_ru_36654972.mp3	Определяющий фактор затора в нашей работе носит сугубо политический характер.	0	2			без акцента		ru	
1a0eea2cb817ad4f14b1465947dd92a6fabdd3a50bb9a62f6675cce6900845b7b709c9be4d77ac2b341c02efa5255cddcb315f13fad7e5feb00ab6a112c4aadd	common_voice_ru_36657103.mp3	Сжалься хоть ты и не мучай!	0	2	twenties	male			ru	
a8a55efe6cd04d8470e91b465fa303839ea9bc4ad54d77dfa0e77702ee8dbc1e925f870646a7ad87d021e611b01125e43fd37073bff78559da97bd7dd02bcf6e	common_voice_ru_36666203.mp3	Алексей Александрович взглянул на него.	0	2					ru	
a8a55efe6cd04d8470e91b465fa303839ea9bc4ad54d77dfa0e77702ee8dbc1e925f870646a7ad87d021e611b01125e43fd37073bff78559da97bd7dd02bcf6e	common_voice_ru_36666206.mp3	Так, братья Галилейского учителя приходили к нему издалека, чтобы унять его пыл.	1	2					ru	
1a0eea2cb817ad4f14b1465947dd92a6fabdd3a50bb9a62f6675cce6900845b7b709c9be4d77ac2b341c02efa5255cddcb315f13fad7e5feb00ab6a112c4aadd	common_voice_ru_36724191.mp3	Одна из первых дам Петербурского света, которую увидел Вронский, была его кузина Бетси.	1	2	twenties	male			ru	
1d616fa1b36f41495749a7364a4a1736a589375a5400d7ed127327df4e552dd5bbe4f71b608a9fa6da682debae8f2f391ae7afe43e3210eabd70a696623bc6fa	common_voice_ru_36742015.mp3	И с божьей помощью мы найдем общую почву для мира.	2	2			без акцента		ru	
1d616fa1b36f41495749a7364a4a1736a589375a5400d7ed127327df4e552dd5bbe4f71b608a9fa6da682debae8f2f391ae7afe43e3210eabd70a696623bc6fa	common_voice_ru_36742054.mp3	В этом мероприятии приняло участие несколько организаций, призвавших к укреплению мира между культурами.	0	2			без акцента		ru	
1d616fa1b36f41495749a7364a4a1736a589375a5400d7ed127327df4e552dd5bbe4f71b608a9fa6da682debae8f2f391ae7afe43e3210eabd70a696623bc6fa	common_voice_ru_36742083.mp3	Министерская компанийка!	0	2			без акцента		ru	
1d616fa1b36f41495749a7364a4a1736a589375a5400d7ed127327df4e552dd5bbe4f71b608a9fa6da682debae8f2f391ae7afe43e3210eabd70a696623bc6fa	common_voice_ru_36742085.mp3	Бангладеш является решительным сторонником многостороннего подхода к разоружению и нераспространению.	0	2			без акцента		ru	
1d616fa1b36f41495749a7364a4a1736a589375a5400d7ed127327df4e552dd5bbe4f71b608a9fa6da682debae8f2f391ae7afe43e3210eabd70a696623bc6fa	common_voice_ru_36742106.mp3	Иван Кузмич не знал, на что решиться.	2	2			без акцента		ru	
1d616fa1b36f41495749a7364a4a1736a589375a5400d7ed127327df4e552dd5bbe4f71b608a9fa6da682debae8f2f391ae7afe43e3210eabd70a696623bc6fa	common_voice_ru_36742108.mp3	«Вешать его!» – сказал Пугачев, не взглянув уже на меня.	0	2			без акцента		ru	
1d616fa1b36f41495749a7364a4a1736a589375a5400d7ed127327df4e552dd5bbe4f71b608a9fa6da682debae8f2f391ae7afe43e3210eabd70a696623bc6fa	common_voice_ru_36742131.mp3	Но об этом рассказывать не буду, потому что все равно никто не поверит.	0	2			без акцента		ru	
1d616fa1b36f41495749a7364a4a1736a589375a5400d7ed127327df4e552dd5bbe4f71b608a9fa6da682debae8f2f391ae7afe43e3210eabd70a696623bc6fa	common_voice_ru_36742160.mp3	Это было должным образом отмечено Генеральным секретарем в его докладе.	0	2			без акцента		ru	
1d616fa1b36f41495749a7364a4a1736a589375a5400d7ed127327df4e552dd5bbe4f71b608a9fa6da682debae8f2f391ae7afe43e3210eabd70a696623bc6fa	common_voice_ru_36742163.mp3	Данные не просто зашифрованы, а зашифрованы дополнительным ключом пользователя	2	2			без акцента		ru	
1d616fa1b36f41495749a7364a4a1736a589375a5400d7ed127327df4e552dd5bbe4f71b608a9fa6da682debae8f2f391ae7afe43e3210eabd70a696623bc6fa	common_voice_ru_36742202.mp3	В этой связи Индонезия обращается с призывом немедленно прекратить все виды насилия.	0	2			без акцента		ru	
1d616fa1b36f41495749a7364a4a1736a589375a5400d7ed127327df4e552dd5bbe4f71b608a9fa6da682debae8f2f391ae7afe43e3210eabd70a696623bc6fa	common_voice_ru_36742247.mp3	Мы встречаемся в сложный период в области разоружения.	2	2			без акцента		ru	
1d616fa1b36f41495749a7364a4a1736a589375a5400d7ed127327df4e552dd5bbe4f71b608a9fa6da682debae8f2f391ae7afe43e3210eabd70a696623bc6fa	common_voice_ru_36742248.mp3	Это важный элемент подтверждения важной роли Организации Объединенных Наций в глобальном управлении.	0	2			без акцента		ru	
1d616fa1b36f41495749a7364a4a1736a589375a5400d7ed127327df4e552dd5bbe4f71b608a9fa6da682debae8f2f391ae7afe43e3210eabd70a696623bc6fa	common_voice_ru_36742249.mp3	Поездка на спектакль.	2	4			без акцента		ru	
1d616fa1b36f41495749a7364a4a1736a589375a5400d7ed127327df4e552dd5bbe4f71b608a9fa6da682debae8f2f391ae7afe43e3210eabd70a696623bc6fa	common_voice_ru_36742304.mp3	О дьявольщина!	0	2			без акцента		ru	
1d616fa1b36f41495749a7364a4a1736a589375a5400d7ed127327df4e552dd5bbe4f71b608a9fa6da682debae8f2f391ae7afe43e3210eabd70a696623bc6fa	common_voice_ru_36742305.mp3	Важно обеспечить полное и эффективное выполнение всех положений Конвенции всеми государствами-участниками.	2	2			без акцента		ru	
1d616fa1b36f41495749a7364a4a1736a589375a5400d7ed127327df4e552dd5bbe4f71b608a9fa6da682debae8f2f391ae7afe43e3210eabd70a696623bc6fa	common_voice_ru_36742338.mp3	Я прибыл сюда с посланием от смелого и гордого народа.	0	2			без акцента		ru	
1d616fa1b36f41495749a7364a4a1736a589375a5400d7ed127327df4e552dd5bbe4f71b608a9fa6da682debae8f2f391ae7afe43e3210eabd70a696623bc6fa	common_voice_ru_36742340.mp3	Не поехать ли?	2	2			без акцента		ru	
1d616fa1b36f41495749a7364a4a1736a589375a5400d7ed127327df4e552dd5bbe4f71b608a9fa6da682debae8f2f391ae7afe43e3210eabd70a696623bc6fa	common_voice_ru_36742394.mp3	Это стало бы крупнейшим гуманитарным кризисом в истории.	2	2			без акцента		ru	
1d616fa1b36f41495749a7364a4a1736a589375a5400d7ed127327df4e552dd5bbe4f71b608a9fa6da682debae8f2f391ae7afe43e3210eabd70a696623bc6fa	common_voice_ru_36742395.mp3	Над всем миром проносятся сильные ветры свободы, осознания уважения человеческого достоинства и социальной справедливости.	0	2			без акцента		ru	
1d616fa1b36f41495749a7364a4a1736a589375a5400d7ed127327df4e552dd5bbe4f71b608a9fa6da682debae8f2f391ae7afe43e3210eabd70a696623bc6fa	common_voice_ru_36742421.mp3	Из присутствия Левин поехал к Щербацким.	0	2			без акцента		ru	
1d616fa1b36f41495749a7364a4a1736a589375a5400d7ed127327df4e552dd5bbe4f71b608a9fa6da682debae8f2f391ae7afe43e3210eabd70a696623bc6fa	common_voice_ru_36742423.mp3	Я также вынужден мириться с военной базой Соединенных Штатов Америки, расположенной в Боливии.	0	2			без акцента		ru	
1d616fa1b36f41495749a7364a4a1736a589375a5400d7ed127327df4e552dd5bbe4f71b608a9fa6da682debae8f2f391ae7afe43e3210eabd70a696623bc6fa	common_voice_ru_36742425.mp3	Хотелось бы добавить к этому еще одну деталь.	0	4			без акцента		ru	
1d616fa1b36f41495749a7364a4a1736a589375a5400d7ed127327df4e552dd5bbe4f71b608a9fa6da682debae8f2f391ae7afe43e3210eabd70a696623bc6fa	common_voice_ru_36742440.mp3	Но однажды утром девочка просыпается немного бодрее, чем всегда.	2	4			без акцента		ru	
1d616fa1b36f41495749a7364a4a1736a589375a5400d7ed127327df4e552dd5bbe4f71b608a9fa6da682debae8f2f391ae7afe43e3210eabd70a696623bc6fa	common_voice_ru_36742444.mp3	Шурочка, у меня к Вам деликатное дело.	0	2			без акцента		ru	
1d616fa1b36f41495749a7364a4a1736a589375a5400d7ed127327df4e552dd5bbe4f71b608a9fa6da682debae8f2f391ae7afe43e3210eabd70a696623bc6fa	common_voice_ru_36742455.mp3	В обмене мнениями примет участие также ряд приглашенных ораторов.	0	2			без акцента		ru	
1d616fa1b36f41495749a7364a4a1736a589375a5400d7ed127327df4e552dd5bbe4f71b608a9fa6da682debae8f2f391ae7afe43e3210eabd70a696623bc6fa	common_voice_ru_36742470.mp3	Переходное правительство прилагает усилия в этом направлении наряду с региональными и международными организациями.	0	2			без акцента		ru	
1d616fa1b36f41495749a7364a4a1736a589375a5400d7ed127327df4e552dd5bbe4f71b608a9fa6da682debae8f2f391ae7afe43e3210eabd70a696623bc6fa	common_voice_ru_36742473.mp3	Инновационные источники финансирования могут дополнять, но не подменять такие обязательства.	0	4			без акцента		ru	
1d616fa1b36f41495749a7364a4a1736a589375a5400d7ed127327df4e552dd5bbe4f71b608a9fa6da682debae8f2f391ae7afe43e3210eabd70a696623bc6fa	common_voice_ru_36742510.mp3	С последствиями глобального экономического кризиса будут бороться все.	2	2			без акцента		ru	
1d616fa1b36f41495749a7364a4a1736a589375a5400d7ed127327df4e552dd5bbe4f71b608a9fa6da682debae8f2f391ae7afe43e3210eabd70a696623bc6fa	common_voice_ru_36742512.mp3	Не понятая мудрость может запылиться.	0	2			без акцента		ru	
1d616fa1b36f41495749a7364a4a1736a589375a5400d7ed127327df4e552dd5bbe4f71b608a9fa6da682debae8f2f391ae7afe43e3210eabd70a696623bc6fa	common_voice_ru_36742528.mp3	Сегодняшняя молодежь — это наше будущее.	2	2			без акцента		ru	
1d616fa1b36f41495749a7364a4a1736a589375a5400d7ed127327df4e552dd5bbe4f71b608a9fa6da682debae8f2f391ae7afe43e3210eabd70a696623bc6fa	common_voice_ru_36742529.mp3	Они символизируют любовь и преданность.	2	2			без акцента		ru	
1d616fa1b36f41495749a7364a4a1736a589375a5400d7ed127327df4e552dd5bbe4f71b608a9fa6da682debae8f2f391ae7afe43e3210eabd70a696623bc6fa	common_voice_ru_36742534.mp3	Анна высунулась вперед, слушая.	0	4			без акцента		ru	
1d616fa1b36f41495749a7364a4a1736a589375a5400d7ed127327df4e552dd5bbe4f71b608a9fa6da682debae8f2f391ae7afe43e3210eabd70a696623bc6fa	common_voice_ru_36742547.mp3	Вот и оно, то самое, чего он уже давно ждал.	2	2			без акцента		ru	
1d616fa1b36f41495749a7364a4a1736a589375a5400d7ed127327df4e552dd5bbe4f71b608a9fa6da682debae8f2f391ae7afe43e3210eabd70a696623bc6fa	common_voice_ru_36742548.mp3	Я вам не приживальщик!	2	2			без акцента		ru	
1d616fa1b36f41495749a7364a4a1736a589375a5400d7ed127327df4e552dd5bbe4f71b608a9fa6da682debae8f2f391ae7afe43e3210eabd70a696623bc6fa	common_voice_ru_36742551.mp3	Аналогичное число евреев, проживавших в арабских странах, также были вынуждены покинуть свои дома.	0	2			без акцента		ru	
1d616fa1b36f41495749a7364a4a1736a589375a5400d7ed127327df4e552dd5bbe4f71b608a9fa6da682debae8f2f391ae7afe43e3210eabd70a696623bc6fa	common_voice_ru_36742583.mp3	Дневной матч, майор.	2	2			без акцента		ru	
1d616fa1b36f41495749a7364a4a1736a589375a5400d7ed127327df4e552dd5bbe4f71b608a9fa6da682debae8f2f391ae7afe43e3210eabd70a696623bc6fa	common_voice_ru_36742587.mp3	Мы вынуждены назвать сложившуюся в этом многостороннем разоруженческом форуме ситуацию структурным кризисом.	0	2			без акцента		ru	
1d616fa1b36f41495749a7364a4a1736a589375a5400d7ed127327df4e552dd5bbe4f71b608a9fa6da682debae8f2f391ae7afe43e3210eabd70a696623bc6fa	common_voice_ru_36742609.mp3	Мы намерены участвовать в предстоящих прениях по этому важному вопросу.	2	2			без акцента		ru	
1d616fa1b36f41495749a7364a4a1736a589375a5400d7ed127327df4e552dd5bbe4f71b608a9fa6da682debae8f2f391ae7afe43e3210eabd70a696623bc6fa	common_voice_ru_36742611.mp3	Мы с нетерпением ожидаем той работы, которая позволит осуществить такие преобразования.	0	4			без акцента		ru	
1d616fa1b36f41495749a7364a4a1736a589375a5400d7ed127327df4e552dd5bbe4f71b608a9fa6da682debae8f2f391ae7afe43e3210eabd70a696623bc6fa	common_voice_ru_36742623.mp3	Оставь, Женечка, оставь	0	4			без акцента		ru	
1d616fa1b36f41495749a7364a4a1736a589375a5400d7ed127327df4e552dd5bbe4f71b608a9fa6da682debae8f2f391ae7afe43e3210eabd70a696623bc6fa	common_voice_ru_36742624.mp3	– Почему так? – спросил я его, скрывая свою досаду.	2	2			без акцента		ru	
1d616fa1b36f41495749a7364a4a1736a589375a5400d7ed127327df4e552dd5bbe4f71b608a9fa6da682debae8f2f391ae7afe43e3210eabd70a696623bc6fa	common_voice_ru_36742637.mp3	Важно также понять, что времена переговоров по дискриминационным многосторонним договорам прошли.	0	2			без акцента		ru	
1d616fa1b36f41495749a7364a4a1736a589375a5400d7ed127327df4e552dd5bbe4f71b608a9fa6da682debae8f2f391ae7afe43e3210eabd70a696623bc6fa	common_voice_ru_36742657.mp3	Правительство Королевства Саудовская Аравия считает, что сохранение статус-кво лишь усугубило бы ситуацию.	0	4			без акцента		ru	
1d616fa1b36f41495749a7364a4a1736a589375a5400d7ed127327df4e552dd5bbe4f71b608a9fa6da682debae8f2f391ae7afe43e3210eabd70a696623bc6fa	common_voice_ru_36742661.mp3	Почему это место называется престол, неизвестно.	2	2			без акцента		ru	
1d616fa1b36f41495749a7364a4a1736a589375a5400d7ed127327df4e552dd5bbe4f71b608a9fa6da682debae8f2f391ae7afe43e3210eabd70a696623bc6fa	common_voice_ru_36742680.mp3	Ядерные аварии не признают границ.	2	2			без акцента		ru	
1d616fa1b36f41495749a7364a4a1736a589375a5400d7ed127327df4e552dd5bbe4f71b608a9fa6da682debae8f2f391ae7afe43e3210eabd70a696623bc6fa	common_voice_ru_36742698.mp3	Марья Ивановна выслушала меня просто, без притворной застенчивости, без затейливых отговорок.	2	2			без акцента		ru	
1d616fa1b36f41495749a7364a4a1736a589375a5400d7ed127327df4e552dd5bbe4f71b608a9fa6da682debae8f2f391ae7afe43e3210eabd70a696623bc6fa	common_voice_ru_36742699.mp3	Для улучшения координации и оказания своевременной и эффективной помощи очень важно укрепить партнерские отношения.	0	4			без акцента		ru	
1d616fa1b36f41495749a7364a4a1736a589375a5400d7ed127327df4e552dd5bbe4f71b608a9fa6da682debae8f2f391ae7afe43e3210eabd70a696623bc6fa	common_voice_ru_36742752.mp3	Всё это создает серьезные угрозы глобальному миру, стабильности, безопасности и сотрудничеству в целях развития.	2	2			без акцента		ru	
1d616fa1b36f41495749a7364a4a1736a589375a5400d7ed127327df4e552dd5bbe4f71b608a9fa6da682debae8f2f391ae7afe43e3210eabd70a696623bc6fa	common_voice_ru_36742754.mp3	И поэтому вопрос для нас ясен: с кем мы?	0	2			без акцента		ru	
1d616fa1b36f41495749a7364a4a1736a589375a5400d7ed127327df4e552dd5bbe4f71b608a9fa6da682debae8f2f391ae7afe43e3210eabd70a696623bc6fa	common_voice_ru_36742785.mp3	Утка крякнула, берега звякнули, море взболталось, вода всколыхалась.	0	4			без акцента		ru	
1d616fa1b36f41495749a7364a4a1736a589375a5400d7ed127327df4e552dd5bbe4f71b608a9fa6da682debae8f2f391ae7afe43e3210eabd70a696623bc6fa	common_voice_ru_36742787.mp3	Одновременно с этим международное сообщество должно продолжать свои усилия по восстановлению стабильности в Сомали.	0	2			без акцента		ru	
1d616fa1b36f41495749a7364a4a1736a589375a5400d7ed127327df4e552dd5bbe4f71b608a9fa6da682debae8f2f391ae7afe43e3210eabd70a696623bc6fa	common_voice_ru_36742788.mp3	Об информационных флешмобах.	2	4			без акцента		ru	
1d616fa1b36f41495749a7364a4a1736a589375a5400d7ed127327df4e552dd5bbe4f71b608a9fa6da682debae8f2f391ae7afe43e3210eabd70a696623bc6fa	common_voice_ru_36742789.mp3	Крайне важно обеспечить, чтобы Африка была частью процессов принятия решений, которые ее затрагивают.	2	2			без акцента		ru	
1d616fa1b36f41495749a7364a4a1736a589375a5400d7ed127327df4e552dd5bbe4f71b608a9fa6da682debae8f2f391ae7afe43e3210eabd70a696623bc6fa	common_voice_ru_36742806.mp3	Я не могу.	0	2			без акцента		ru	
1d616fa1b36f41495749a7364a4a1736a589375a5400d7ed127327df4e552dd5bbe4f71b608a9fa6da682debae8f2f391ae7afe43e3210eabd70a696623bc6fa	common_voice_ru_36742807.mp3	Сейчас я хотел бы коснуться реформы Совета Безопасности.	2	2			без акцента		ru	
1d616fa1b36f41495749a7364a4a1736a589375a5400d7ed127327df4e552dd5bbe4f71b608a9fa6da682debae8f2f391ae7afe43e3210eabd70a696623bc6fa	common_voice_ru_36742808.mp3	В то же время, одних только разговоров недостаточно.	2	2			без акцента		ru	
1d616fa1b36f41495749a7364a4a1736a589375a5400d7ed127327df4e552dd5bbe4f71b608a9fa6da682debae8f2f391ae7afe43e3210eabd70a696623bc6fa	common_voice_ru_36742809.mp3	месяц	2	2			без акцента		ru	
1d616fa1b36f41495749a7364a4a1736a589375a5400d7ed127327df4e552dd5bbe4f71b608a9fa6da682debae8f2f391ae7afe43e3210eabd70a696623bc6fa	common_voice_ru_36742821.mp3	Степан Аркадьич любил хорошую шутку.	0	4			без акцента		ru	
1d616fa1b36f41495749a7364a4a1736a589375a5400d7ed127327df4e552dd5bbe4f71b608a9fa6da682debae8f2f391ae7afe43e3210eabd70a696623bc6fa	common_voice_ru_36742823.mp3	Давайте же все вместе почтим его память!	2	2			без акцента		ru	
1d616fa1b36f41495749a7364a4a1736a589375a5400d7ed127327df4e552dd5bbe4f71b608a9fa6da682debae8f2f391ae7afe43e3210eabd70a696623bc6fa	common_voice_ru_36742824.mp3	Заверяю вас в полной поддержке и сотрудничестве моей делегации в связи с вашим председательством.	2	2			без акцента		ru	
1d616fa1b36f41495749a7364a4a1736a589375a5400d7ed127327df4e552dd5bbe4f71b608a9fa6da682debae8f2f391ae7afe43e3210eabd70a696623bc6fa	common_voice_ru_36742825.mp3	А теперь я предоставляю слово послу Швеции Яну Кнутссону.	2	2			без акцента		ru	
1d616fa1b36f41495749a7364a4a1736a589375a5400d7ed127327df4e552dd5bbe4f71b608a9fa6da682debae8f2f391ae7afe43e3210eabd70a696623bc6fa	common_voice_ru_36742835.mp3	А теперь, ради бога, успокой бедную девушку, которую гусары твои перепугали.	0	2			без акцента		ru	
1d616fa1b36f41495749a7364a4a1736a589375a5400d7ed127327df4e552dd5bbe4f71b608a9fa6da682debae8f2f391ae7afe43e3210eabd70a696623bc6fa	common_voice_ru_36742836.mp3	Политические аспекты и проблемы безопасности всегда были важным приоритетом для Организации Объединенных Наций.	2	2			без акцента		ru	
1d616fa1b36f41495749a7364a4a1736a589375a5400d7ed127327df4e552dd5bbe4f71b608a9fa6da682debae8f2f391ae7afe43e3210eabd70a696623bc6fa	common_voice_ru_36742837.mp3	Чудное утро было.	2	2			без акцента		ru	
1d616fa1b36f41495749a7364a4a1736a589375a5400d7ed127327df4e552dd5bbe4f71b608a9fa6da682debae8f2f391ae7afe43e3210eabd70a696623bc6fa	common_voice_ru_36742838.mp3	Одним из примеров тому служит нынешняя угроза пиратства.	0	2			без акцента		ru	
1d616fa1b36f41495749a7364a4a1736a589375a5400d7ed127327df4e552dd5bbe4f71b608a9fa6da682debae8f2f391ae7afe43e3210eabd70a696623bc6fa	common_voice_ru_36742839.mp3	Выступление Исполняющего обязанности Председателя.	0	4			без акцента		ru	
1d616fa1b36f41495749a7364a4a1736a589375a5400d7ed127327df4e552dd5bbe4f71b608a9fa6da682debae8f2f391ae7afe43e3210eabd70a696623bc6fa	common_voice_ru_36742848.mp3	А выбросы парниковых газов попрежнему смертельно опасными темпами ускоряют процесс глобального потепления.	0	2			без акцента		ru	
1d616fa1b36f41495749a7364a4a1736a589375a5400d7ed127327df4e552dd5bbe4f71b608a9fa6da682debae8f2f391ae7afe43e3210eabd70a696623bc6fa	common_voice_ru_36742849.mp3	Если это так, то я направлю в свою столицу доклад на этот счет.	2	2			без акцента		ru	
1d616fa1b36f41495749a7364a4a1736a589375a5400d7ed127327df4e552dd5bbe4f71b608a9fa6da682debae8f2f391ae7afe43e3210eabd70a696623bc6fa	common_voice_ru_36742851.mp3	Они уже сюда вернулись, и я могу помахать им всем рукой.	2	2			без акцента		ru	
1d616fa1b36f41495749a7364a4a1736a589375a5400d7ed127327df4e552dd5bbe4f71b608a9fa6da682debae8f2f391ae7afe43e3210eabd70a696623bc6fa	common_voice_ru_36742857.mp3	Меры по борьбе с этой угрозой вполне оправданны.	0	2			без акцента		ru	
1d616fa1b36f41495749a7364a4a1736a589375a5400d7ed127327df4e552dd5bbe4f71b608a9fa6da682debae8f2f391ae7afe43e3210eabd70a696623bc6fa	common_voice_ru_36742863.mp3	Алексей Александрович провожал ее.	2	2			без акцента		ru	
1d616fa1b36f41495749a7364a4a1736a589375a5400d7ed127327df4e552dd5bbe4f71b608a9fa6da682debae8f2f391ae7afe43e3210eabd70a696623bc6fa	common_voice_ru_36742864.mp3	Позвольте мне вновь заявить о поддержке нашей страной идеи заключения договора о торговле оружием.	2	2			без акцента		ru	
