client_id	path	sentence	up_votes	down_votes	age	gender	accents	variant	locale	segment
1df0889dc131917fcadc1f23a5ebfccc258d19c846c86f181253ebd2f4228a441bf95efd701990f481570128b479622aa04cb0dc5940fad90335f1df29c9833a	common_voice_ru_36531370.mp3	Вы скольких мест член, Николай Иваныч?	1	2	fourties	male			ru	
1df0889dc131917fcadc1f23a5ebfccc258d19c846c86f181253ebd2f4228a441bf95efd701990f481570128b479622aa04cb0dc5940fad90335f1df29c9833a	common_voice_ru_36531373.mp3	Фокусник рельсы тянет из пасти трамвая, скрыт циферблатами башни.	0	2	fourties	male			ru	
1df0889dc131917fcadc1f23a5ebfccc258d19c846c86f181253ebd2f4228a441bf95efd701990f481570128b479622aa04cb0dc5940fad90335f1df29c9833a	common_voice_ru_36531395.mp3	Если б быть мне косноязычным, как Дант или Петрарка!	1	2	fourties	male			ru	
1d616fa1b36f41495749a7364a4a1736a589375a5400d7ed127327df4e552dd5bbe4f71b608a9fa6da682debae8f2f391ae7afe43e3210eabd70a696623bc6fa	common_voice_ru_36534119.mp3	Более определенные параметры обретает сложная природа эвентуального соглашения по расщепляющемуся материалу.	0	2			без акцента		ru	
1d616fa1b36f41495749a7364a4a1736a589375a5400d7ed127327df4e552dd5bbe4f71b608a9fa6da682debae8f2f391ae7afe43e3210eabd70a696623bc6fa	common_voice_ru_36539680.mp3	Я предоставляю слово представителю Исламской Республики Иран по порядку ведения заседания.	0	2			без акцента		ru	
1d616fa1b36f41495749a7364a4a1736a589375a5400d7ed127327df4e552dd5bbe4f71b608a9fa6da682debae8f2f391ae7afe43e3210eabd70a696623bc6fa	common_voice_ru_36540603.mp3	Кто будет национализовать один другого?	2	2			без акцента		ru	
97c5319cd514d32eb50cd74603812180c7b3490f47b4b0d9707e3deea8065ca804e03cb85b039bc57d6d2eed870e11bed62131379981e042bab54ca608965d28	common_voice_ru_36541326.mp3	«Аттракцион невиданной щедрости! Купите пятьдесят рублей за сто!» — зазывал прохожих мальчишка.	0	2					ru	
97c5319cd514d32eb50cd74603812180c7b3490f47b4b0d9707e3deea8065ca804e03cb85b039bc57d6d2eed870e11bed62131379981e042bab54ca608965d28	common_voice_ru_36541328.mp3	Даве тут проехали все верхами жнею смотреть.	1	2					ru	
2498b8f6d3f13d354d51c611bb86e5b8eea2eecdd511b64290ee099ddaab22f5b788656f3ec5a6b37a99cba301095f8aef0111520e7ff033a3edf8849b64a453	common_voice_ru_36547649.mp3	А если взаимно, вскрыв мошну тугую, предлагают: – Давайте честно поторгуем!	0	2					ru	
2498b8f6d3f13d354d51c611bb86e5b8eea2eecdd511b64290ee099ddaab22f5b788656f3ec5a6b37a99cba301095f8aef0111520e7ff033a3edf8849b64a453	common_voice_ru_36547651.mp3	Мне стало лень засыпать.	0	2					ru	
2498b8f6d3f13d354d51c611bb86e5b8eea2eecdd511b64290ee099ddaab22f5b788656f3ec5a6b37a99cba301095f8aef0111520e7ff033a3edf8849b64a453	common_voice_ru_36547652.mp3	Когда обе женщины сели в коляску, на обеих вдруг нашло смущение.	0	2					ru	
1d616fa1b36f41495749a7364a4a1736a589375a5400d7ed127327df4e552dd5bbe4f71b608a9fa6da682debae8f2f391ae7afe43e3210eabd70a696623bc6fa	common_voice_ru_36599213.mp3	Размягченное сердце не могло успокоиться в его груди.	2	2			без акцента		ru	
1d616fa1b36f41495749a7364a4a1736a589375a5400d7ed127327df4e552dd5bbe4f71b608a9fa6da682debae8f2f391ae7afe43e3210eabd70a696623bc6fa	common_voice_ru_36599216.mp3	Повестку дня Генеральной Ассамблеи можно рационализировать, чтобы наши обсуждения стали более целенаправленными.	0	2			без акцента		ru	
1d616fa1b36f41495749a7364a4a1736a589375a5400d7ed127327df4e552dd5bbe4f71b608a9fa6da682debae8f2f391ae7afe43e3210eabd70a696623bc6fa	common_voice_ru_36599218.mp3	По этой причине процесс установки полностью автоматизирован	2	2			без акцента		ru	
1d616fa1b36f41495749a7364a4a1736a589375a5400d7ed127327df4e552dd5bbe4f71b608a9fa6da682debae8f2f391ae7afe43e3210eabd70a696623bc6fa	common_voice_ru_36599295.mp3	Южнокорейские власти осуществляют подобную военную провокацию даже в то время, когда ведется диалог.	2	2			без акцента		ru	
1d616fa1b36f41495749a7364a4a1736a589375a5400d7ed127327df4e552dd5bbe4f71b608a9fa6da682debae8f2f391ae7afe43e3210eabd70a696623bc6fa	common_voice_ru_36599299.mp3	Мы искренне поздравляем его с вступлением на этот пост.	0	4			без акцента		ru	
1d616fa1b36f41495749a7364a4a1736a589375a5400d7ed127327df4e552dd5bbe4f71b608a9fa6da682debae8f2f391ae7afe43e3210eabd70a696623bc6fa	common_voice_ru_36599351.mp3	Мы понимаем, что эта концепция не обеспечивает универсальное решение.	2	2			без акцента		ru	
1d616fa1b36f41495749a7364a4a1736a589375a5400d7ed127327df4e552dd5bbe4f71b608a9fa6da682debae8f2f391ae7afe43e3210eabd70a696623bc6fa	common_voice_ru_36599355.mp3	Дело не только в личной жизни.	2	2			без акцента		ru	
1d616fa1b36f41495749a7364a4a1736a589375a5400d7ed127327df4e552dd5bbe4f71b608a9fa6da682debae8f2f391ae7afe43e3210eabd70a696623bc6fa	common_voice_ru_36599479.mp3	Минута молчания, посвященная молитве или размышлению.	2	2			без акцента		ru	
1d616fa1b36f41495749a7364a4a1736a589375a5400d7ed127327df4e552dd5bbe4f71b608a9fa6da682debae8f2f391ae7afe43e3210eabd70a696623bc6fa	common_voice_ru_36599482.mp3	С первого взгляда она не очень мне понравилась.	0	4			без акцента		ru	
1d616fa1b36f41495749a7364a4a1736a589375a5400d7ed127327df4e552dd5bbe4f71b608a9fa6da682debae8f2f391ae7afe43e3210eabd70a696623bc6fa	common_voice_ru_36599490.mp3	Стоит поп на копне, колпак на попе, копна под попом, поп под колпаком.	2	4			без акцента		ru	
1d616fa1b36f41495749a7364a4a1736a589375a5400d7ed127327df4e552dd5bbe4f71b608a9fa6da682debae8f2f391ae7afe43e3210eabd70a696623bc6fa	common_voice_ru_36599542.mp3	Пустые, глупые слова!	2	2			без акцента		ru	
1d616fa1b36f41495749a7364a4a1736a589375a5400d7ed127327df4e552dd5bbe4f71b608a9fa6da682debae8f2f391ae7afe43e3210eabd70a696623bc6fa	common_voice_ru_36599573.mp3	Это новая больница.	0	2			без акцента		ru	
1d616fa1b36f41495749a7364a4a1736a589375a5400d7ed127327df4e552dd5bbe4f71b608a9fa6da682debae8f2f391ae7afe43e3210eabd70a696623bc6fa	common_voice_ru_36599622.mp3	Ассамблее предстоит иметь дело с большой и насыщенной повесткой дня.	2	2			без акцента		ru	
1d616fa1b36f41495749a7364a4a1736a589375a5400d7ed127327df4e552dd5bbe4f71b608a9fa6da682debae8f2f391ae7afe43e3210eabd70a696623bc6fa	common_voice_ru_36599623.mp3	Другого слова для этого нет.	0	4			без акцента		ru	
1d616fa1b36f41495749a7364a4a1736a589375a5400d7ed127327df4e552dd5bbe4f71b608a9fa6da682debae8f2f391ae7afe43e3210eabd70a696623bc6fa	common_voice_ru_36599624.mp3	Юля юлила, а Константин все констатировал и констатировал.	0	4			без акцента		ru	
1d616fa1b36f41495749a7364a4a1736a589375a5400d7ed127327df4e552dd5bbe4f71b608a9fa6da682debae8f2f391ae7afe43e3210eabd70a696623bc6fa	common_voice_ru_36599625.mp3	Несоблюдение Сирией ее соглашения о гарантиях также вызывает озабоченность.	0	4			без акцента		ru	
1d616fa1b36f41495749a7364a4a1736a589375a5400d7ed127327df4e552dd5bbe4f71b608a9fa6da682debae8f2f391ae7afe43e3210eabd70a696623bc6fa	common_voice_ru_36599672.mp3	Долли только что была в кабинете и предложила доктору прилечь.	0	4			без акцента		ru	
1d616fa1b36f41495749a7364a4a1736a589375a5400d7ed127327df4e552dd5bbe4f71b608a9fa6da682debae8f2f391ae7afe43e3210eabd70a696623bc6fa	common_voice_ru_36599675.mp3	Из Ирландского республиканского командования.	0	4			без акцента		ru	
1d616fa1b36f41495749a7364a4a1736a589375a5400d7ed127327df4e552dd5bbe4f71b608a9fa6da682debae8f2f391ae7afe43e3210eabd70a696623bc6fa	common_voice_ru_36599676.mp3	Тема наших сегодняшних прений — «Роль посредничества в урегулировании споров».	2	2			без акцента		ru	
1d616fa1b36f41495749a7364a4a1736a589375a5400d7ed127327df4e552dd5bbe4f71b608a9fa6da682debae8f2f391ae7afe43e3210eabd70a696623bc6fa	common_voice_ru_36599720.mp3	Это история людей, сделавших выбор между добром и злом в обществе в пользу добра.	2	2			без акцента		ru	
1d616fa1b36f41495749a7364a4a1736a589375a5400d7ed127327df4e552dd5bbe4f71b608a9fa6da682debae8f2f391ae7afe43e3210eabd70a696623bc6fa	common_voice_ru_36599729.mp3	Мы разочарованы тем, что мы вновь не смогли поддержать данный проект резолюции.	0	4			без акцента		ru	
1d616fa1b36f41495749a7364a4a1736a589375a5400d7ed127327df4e552dd5bbe4f71b608a9fa6da682debae8f2f391ae7afe43e3210eabd70a696623bc6fa	common_voice_ru_36599762.mp3	Эти страны взяли на себя роль лидера.	2	4			без акцента		ru	
1d616fa1b36f41495749a7364a4a1736a589375a5400d7ed127327df4e552dd5bbe4f71b608a9fa6da682debae8f2f391ae7afe43e3210eabd70a696623bc6fa	common_voice_ru_36599763.mp3	Савельич чуть не завыл, услышав, как нитки затрещали.	2	2			без акцента		ru	
1d616fa1b36f41495749a7364a4a1736a589375a5400d7ed127327df4e552dd5bbe4f71b608a9fa6da682debae8f2f391ae7afe43e3210eabd70a696623bc6fa	common_voice_ru_36599836.mp3	Правительствам и людям по всему миру приходится нелегко.	0	2			без акцента		ru	
1d616fa1b36f41495749a7364a4a1736a589375a5400d7ed127327df4e552dd5bbe4f71b608a9fa6da682debae8f2f391ae7afe43e3210eabd70a696623bc6fa	common_voice_ru_36599879.mp3	Действительно, мы должны сообща воспользоваться представленной нам уникальной возможностью.	2	4			без акцента		ru	
1d616fa1b36f41495749a7364a4a1736a589375a5400d7ed127327df4e552dd5bbe4f71b608a9fa6da682debae8f2f391ae7afe43e3210eabd70a696623bc6fa	common_voice_ru_36599959.mp3	Я смотрел на нее с предубеждением: Швабрин описал мне Машу, капитанскую дочь, совершенною дурочкою.	0	2			без акцента		ru	
1d616fa1b36f41495749a7364a4a1736a589375a5400d7ed127327df4e552dd5bbe4f71b608a9fa6da682debae8f2f391ae7afe43e3210eabd70a696623bc6fa	common_voice_ru_36599962.mp3	И вот возьми телеграмму, передай, что они скажут.	2	2			без акцента		ru	
1d616fa1b36f41495749a7364a4a1736a589375a5400d7ed127327df4e552dd5bbe4f71b608a9fa6da682debae8f2f391ae7afe43e3210eabd70a696623bc6fa	common_voice_ru_36599965.mp3	– У попадьи! – вскричал я с ужасом.	0	4			без акцента		ru	
1d616fa1b36f41495749a7364a4a1736a589375a5400d7ed127327df4e552dd5bbe4f71b608a9fa6da682debae8f2f391ae7afe43e3210eabd70a696623bc6fa	common_voice_ru_36599988.mp3	Левин презрительно улыбнулся.	2	4			без акцента		ru	
1d616fa1b36f41495749a7364a4a1736a589375a5400d7ed127327df4e552dd5bbe4f71b608a9fa6da682debae8f2f391ae7afe43e3210eabd70a696623bc6fa	common_voice_ru_36600040.mp3	Это единственная заслуживающая доверия мирная инициатива.	2	2			без акцента		ru	
1d616fa1b36f41495749a7364a4a1736a589375a5400d7ed127327df4e552dd5bbe4f71b608a9fa6da682debae8f2f391ae7afe43e3210eabd70a696623bc6fa	common_voice_ru_36600041.mp3	Чего бояться? Разве они кусаются?	0	4			без акцента		ru	
1d616fa1b36f41495749a7364a4a1736a589375a5400d7ed127327df4e552dd5bbe4f71b608a9fa6da682debae8f2f391ae7afe43e3210eabd70a696623bc6fa	common_voice_ru_36600045.mp3	Выражение соболезнования в связи со стихийным бедствием в Японии.	0	4			без акцента		ru	
1d616fa1b36f41495749a7364a4a1736a589375a5400d7ed127327df4e552dd5bbe4f71b608a9fa6da682debae8f2f391ae7afe43e3210eabd70a696623bc6fa	common_voice_ru_36600101.mp3	Но все равно, я люблю этот город.	0	4			без акцента		ru	
1d616fa1b36f41495749a7364a4a1736a589375a5400d7ed127327df4e552dd5bbe4f71b608a9fa6da682debae8f2f391ae7afe43e3210eabd70a696623bc6fa	common_voice_ru_36600103.mp3	Приехала бабушка из Израиля	2	2			без акцента		ru	
1d616fa1b36f41495749a7364a4a1736a589375a5400d7ed127327df4e552dd5bbe4f71b608a9fa6da682debae8f2f391ae7afe43e3210eabd70a696623bc6fa	common_voice_ru_36600145.mp3	Каждое общество, каждая культура предлагает свой путь для продвижения вперед человечества.	2	2			без акцента		ru	
1d616fa1b36f41495749a7364a4a1736a589375a5400d7ed127327df4e552dd5bbe4f71b608a9fa6da682debae8f2f391ae7afe43e3210eabd70a696623bc6fa	common_voice_ru_36600147.mp3	Мы не согласны, что это не реалистично, но мы считаемся с позицией некоторых стран.	0	4			без акцента		ru	
1d616fa1b36f41495749a7364a4a1736a589375a5400d7ed127327df4e552dd5bbe4f71b608a9fa6da682debae8f2f391ae7afe43e3210eabd70a696623bc6fa	common_voice_ru_36600149.mp3	Все эти предложения включены во второй пересмотренный вариант основного текста межправительственных переговоров.	2	2			без акцента		ru	
1d616fa1b36f41495749a7364a4a1736a589375a5400d7ed127327df4e552dd5bbe4f71b608a9fa6da682debae8f2f391ae7afe43e3210eabd70a696623bc6fa	common_voice_ru_36600178.mp3	Ненавижу я этого лекаришку.	0	4			без акцента		ru	
1d616fa1b36f41495749a7364a4a1736a589375a5400d7ed127327df4e552dd5bbe4f71b608a9fa6da682debae8f2f391ae7afe43e3210eabd70a696623bc6fa	common_voice_ru_36600179.mp3	Наоборот, сегодня на нас лежит общая ответственность по сохранению и укреплению этого органа.	0	4			без акцента		ru	
1d616fa1b36f41495749a7364a4a1736a589375a5400d7ed127327df4e552dd5bbe4f71b608a9fa6da682debae8f2f391ae7afe43e3210eabd70a696623bc6fa	common_voice_ru_36600181.mp3	В выходные дни трудно выбраться из дома.	2	2			без акцента		ru	
1d616fa1b36f41495749a7364a4a1736a589375a5400d7ed127327df4e552dd5bbe4f71b608a9fa6da682debae8f2f391ae7afe43e3210eabd70a696623bc6fa	common_voice_ru_36600182.mp3	Сейчас я прерву заседание на несколько минут, чтобы наши гости могли покинуть зал заседаний.	2	4			без акцента		ru	
1d616fa1b36f41495749a7364a4a1736a589375a5400d7ed127327df4e552dd5bbe4f71b608a9fa6da682debae8f2f391ae7afe43e3210eabd70a696623bc6fa	common_voice_ru_36600188.mp3	Я вспоминаю, что это невозможно, и стараюсь не напрягать мысли.	0	2			без акцента		ru	
1d616fa1b36f41495749a7364a4a1736a589375a5400d7ed127327df4e552dd5bbe4f71b608a9fa6da682debae8f2f391ae7afe43e3210eabd70a696623bc6fa	common_voice_ru_36600240.mp3	Кроме того, мы отмежевываемся от резолюции и не будем считать себя связанными ею.	2	2			без акцента		ru	
1d616fa1b36f41495749a7364a4a1736a589375a5400d7ed127327df4e552dd5bbe4f71b608a9fa6da682debae8f2f391ae7afe43e3210eabd70a696623bc6fa	common_voice_ru_36600266.mp3	«Зачем нам секунданты, – сказал он мне сухо, – без них обойдемся».	0	2			без акцента		ru	
1d616fa1b36f41495749a7364a4a1736a589375a5400d7ed127327df4e552dd5bbe4f71b608a9fa6da682debae8f2f391ae7afe43e3210eabd70a696623bc6fa	common_voice_ru_36600268.mp3	Сделайте мне бутерброд с сыром.	0	4			без акцента		ru	
1d616fa1b36f41495749a7364a4a1736a589375a5400d7ed127327df4e552dd5bbe4f71b608a9fa6da682debae8f2f391ae7afe43e3210eabd70a696623bc6fa	common_voice_ru_36600303.mp3	Из кузова в кузов шла перегрузка арбузов.	0	4			без акцента		ru	
1d616fa1b36f41495749a7364a4a1736a589375a5400d7ed127327df4e552dd5bbe4f71b608a9fa6da682debae8f2f391ae7afe43e3210eabd70a696623bc6fa	common_voice_ru_36600307.mp3	Добросовестное укрепление ядерной безопасности имеет важнейшее значение для мирного использования ядерной энергии и нераспространения.	0	2			без акцента		ru	
1d616fa1b36f41495749a7364a4a1736a589375a5400d7ed127327df4e552dd5bbe4f71b608a9fa6da682debae8f2f391ae7afe43e3210eabd70a696623bc6fa	common_voice_ru_36600309.mp3	Ну а ещё чего делал?	0	4			без акцента		ru	
1d616fa1b36f41495749a7364a4a1736a589375a5400d7ed127327df4e552dd5bbe4f71b608a9fa6da682debae8f2f391ae7afe43e3210eabd70a696623bc6fa	common_voice_ru_36600334.mp3	Включи какой-нибудь подкаст	2	2			без акцента		ru	
1d616fa1b36f41495749a7364a4a1736a589375a5400d7ed127327df4e552dd5bbe4f71b608a9fa6da682debae8f2f391ae7afe43e3210eabd70a696623bc6fa	common_voice_ru_36600381.mp3	Я не хотела тебе говорить этого, но ты заставил меня.	2	2			без акцента		ru	
1d616fa1b36f41495749a7364a4a1736a589375a5400d7ed127327df4e552dd5bbe4f71b608a9fa6da682debae8f2f391ae7afe43e3210eabd70a696623bc6fa	common_voice_ru_36600382.mp3	Этот вопрос теперь находится в ведении правительства Исландии.	2	2			без акцента		ru	
1d616fa1b36f41495749a7364a4a1736a589375a5400d7ed127327df4e552dd5bbe4f71b608a9fa6da682debae8f2f391ae7afe43e3210eabd70a696623bc6fa	common_voice_ru_36600383.mp3	На прошлой неделе я посетил Триполи и Бенгази.	2	2			без акцента		ru	
1d616fa1b36f41495749a7364a4a1736a589375a5400d7ed127327df4e552dd5bbe4f71b608a9fa6da682debae8f2f391ae7afe43e3210eabd70a696623bc6fa	common_voice_ru_36600384.mp3	Вы не коты, чтобы усами шевелить.	0	2			без акцента		ru	
1d616fa1b36f41495749a7364a4a1736a589375a5400d7ed127327df4e552dd5bbe4f71b608a9fa6da682debae8f2f391ae7afe43e3210eabd70a696623bc6fa	common_voice_ru_36600414.mp3	Охота оказалась хуже, чем ожидал Левин.	2	2			без акцента		ru	
1d616fa1b36f41495749a7364a4a1736a589375a5400d7ed127327df4e552dd5bbe4f71b608a9fa6da682debae8f2f391ae7afe43e3210eabd70a696623bc6fa	common_voice_ru_36600417.mp3	Доклады Шестого комитета.	0	2			без акцента		ru	
1d616fa1b36f41495749a7364a4a1736a589375a5400d7ed127327df4e552dd5bbe4f71b608a9fa6da682debae8f2f391ae7afe43e3210eabd70a696623bc6fa	common_voice_ru_36600445.mp3	Губы ее дрожали так, что долго она не могла ничего говорить.	2	2			без акцента		ru	
1d616fa1b36f41495749a7364a4a1736a589375a5400d7ed127327df4e552dd5bbe4f71b608a9fa6da682debae8f2f391ae7afe43e3210eabd70a696623bc6fa	common_voice_ru_36600446.mp3	Мы твердо убеждены в неприемлемости увеличения числа постоянных членов.	2	2			без акцента		ru	
1d616fa1b36f41495749a7364a4a1736a589375a5400d7ed127327df4e552dd5bbe4f71b608a9fa6da682debae8f2f391ae7afe43e3210eabd70a696623bc6fa	common_voice_ru_36600448.mp3	Мы должны использовать каждую из существующих возможностей для реанимации Конференции.	2	4			без акцента		ru	
1d616fa1b36f41495749a7364a4a1736a589375a5400d7ed127327df4e552dd5bbe4f71b608a9fa6da682debae8f2f391ae7afe43e3210eabd70a696623bc6fa	common_voice_ru_36600482.mp3	Мы надеемся, что эти связи будут укрепляться.	2	2			без акцента		ru	
1d616fa1b36f41495749a7364a4a1736a589375a5400d7ed127327df4e552dd5bbe4f71b608a9fa6da682debae8f2f391ae7afe43e3210eabd70a696623bc6fa	common_voice_ru_36600484.mp3	Право, не знаю, о ком бы еще упомянуть, чтобы не забыть кого.	0	2			без акцента		ru	
1d616fa1b36f41495749a7364a4a1736a589375a5400d7ed127327df4e552dd5bbe4f71b608a9fa6da682debae8f2f391ae7afe43e3210eabd70a696623bc6fa	common_voice_ru_36600486.mp3	Мы надеемся, что в будущем другие народы скажут нам спасибо за такой превентивный шаг.	0	4			без акцента		ru	
1d616fa1b36f41495749a7364a4a1736a589375a5400d7ed127327df4e552dd5bbe4f71b608a9fa6da682debae8f2f391ae7afe43e3210eabd70a696623bc6fa	common_voice_ru_36600498.mp3	Семи пядей во лбу.	2	2			без акцента		ru	
1d616fa1b36f41495749a7364a4a1736a589375a5400d7ed127327df4e552dd5bbe4f71b608a9fa6da682debae8f2f391ae7afe43e3210eabd70a696623bc6fa	common_voice_ru_36600501.mp3	Мы можем внести изменение в ходе следующего цикла.	0	2			без акцента		ru	
1d616fa1b36f41495749a7364a4a1736a589375a5400d7ed127327df4e552dd5bbe4f71b608a9fa6da682debae8f2f391ae7afe43e3210eabd70a696623bc6fa	common_voice_ru_36600542.mp3	Ну, так мы одни.	0	2			без акцента		ru	
1d616fa1b36f41495749a7364a4a1736a589375a5400d7ed127327df4e552dd5bbe4f71b608a9fa6da682debae8f2f391ae7afe43e3210eabd70a696623bc6fa	common_voice_ru_36600543.mp3	Почему ваши люди захотят ей помочь?	0	2			без акцента		ru	
1d616fa1b36f41495749a7364a4a1736a589375a5400d7ed127327df4e552dd5bbe4f71b608a9fa6da682debae8f2f391ae7afe43e3210eabd70a696623bc6fa	common_voice_ru_36600567.mp3	Он нахмурился на слова Катавасова и сказал другое.	0	2			без акцента		ru	
1d616fa1b36f41495749a7364a4a1736a589375a5400d7ed127327df4e552dd5bbe4f71b608a9fa6da682debae8f2f391ae7afe43e3210eabd70a696623bc6fa	common_voice_ru_36600569.mp3	Сверху льет.	0	4			без акцента		ru	
1d616fa1b36f41495749a7364a4a1736a589375a5400d7ed127327df4e552dd5bbe4f71b608a9fa6da682debae8f2f391ae7afe43e3210eabd70a696623bc6fa	common_voice_ru_36600570.mp3	Долг международного сообщества — поддержать их.	0	2			без акцента		ru	
1d616fa1b36f41495749a7364a4a1736a589375a5400d7ed127327df4e552dd5bbe4f71b608a9fa6da682debae8f2f391ae7afe43e3210eabd70a696623bc6fa	common_voice_ru_36600601.mp3	Она подняла чашку, отставив мизинец, и поднесла ее ко рту.	0	4			без акцента		ru	
1d616fa1b36f41495749a7364a4a1736a589375a5400d7ed127327df4e552dd5bbe4f71b608a9fa6da682debae8f2f391ae7afe43e3210eabd70a696623bc6fa	common_voice_ru_36600602.mp3	Мир тесно взаимосвязан, поэтому последствия любого кризиса не могут носить локальный характер.	2	2			без акцента		ru	
1d616fa1b36f41495749a7364a4a1736a589375a5400d7ed127327df4e552dd5bbe4f71b608a9fa6da682debae8f2f391ae7afe43e3210eabd70a696623bc6fa	common_voice_ru_36600604.mp3	Ты ведь парень не промах.	2	4			без акцента		ru	
1d616fa1b36f41495749a7364a4a1736a589375a5400d7ed127327df4e552dd5bbe4f71b608a9fa6da682debae8f2f391ae7afe43e3210eabd70a696623bc6fa	common_voice_ru_36613029.mp3	Глаза эти светились ближе и ближе, ослепляя его своим светом любви.	2	2			без акцента		ru	
1d616fa1b36f41495749a7364a4a1736a589375a5400d7ed127327df4e552dd5bbe4f71b608a9fa6da682debae8f2f391ae7afe43e3210eabd70a696623bc6fa	common_voice_ru_36613034.mp3	Сегодня отмечается тревожная тенденция к росту радикализации молодежи.	2	2			без акцента		ru	
1d616fa1b36f41495749a7364a4a1736a589375a5400d7ed127327df4e552dd5bbe4f71b608a9fa6da682debae8f2f391ae7afe43e3210eabd70a696623bc6fa	common_voice_ru_36613154.mp3	Сейчас я предоставляю слово представителю Кувейта.	0	2			без акцента		ru	
1d616fa1b36f41495749a7364a4a1736a589375a5400d7ed127327df4e552dd5bbe4f71b608a9fa6da682debae8f2f391ae7afe43e3210eabd70a696623bc6fa	common_voice_ru_36613187.mp3	Я с ума схожу от грязи, а вы говорите — дом!	0	2			без акцента		ru	
1d616fa1b36f41495749a7364a4a1736a589375a5400d7ed127327df4e552dd5bbe4f71b608a9fa6da682debae8f2f391ae7afe43e3210eabd70a696623bc6fa	common_voice_ru_36613191.mp3	Я и вытащил ребенка.	0	2			без акцента		ru	
